{
  "specversion": "1.0",
  "id": "00000000-0000-4000-8000-000000000005",
  "source": "urn:todolima:fixture:phase0",
  "type": "com.hazlocrecer.agent.succeeded.v1",
  "subject": "run-golden-001",
  "time": "2026-09-29T12:00:01Z",
  "datacontenttype": "application/json",
  "dataschema": "https://schemas.hazlocrecer.com/events/agent.succeeded.schema.json",
  "correlationid": "golden-flow-001",
  "causationid": "00000000-0000-4000-8000-000000000004",
  "businessid": "golden-business-synthetic-001",
  "data": {
    "schema_version": "0.1.0",
    "artifact_hash": "9c761dca6172351da6b6e7a7671c3358e603596db06f33c9939f17798c15cb00",
    "document": {
      "schema_version": "0.1.0",
      "run_id": "run-golden-001",
      "business_id": "golden-business-synthetic-001",
      "agent": {
        "name": "synthetic-contract-fixture",
        "version": "0.1.0"
      },
      "status": "succeeded",
      "started_at": "2026-09-29T12:00:00Z",
      "finished_at": "2026-09-29T12:00:01Z",
      "inputs": [
        {
          "kind": "business-truth",
          "ref": "examples/golden-business/business-truth.json",
          "content_hash": "de59f2135a5fa19bcd08b136d23574bd46a8e056098891f3d0e7b09526227e87"
        },
        {
          "kind": "vertical-recipe",
          "ref": "examples/golden-business/vertical-recipe.json",
          "content_hash": "692aef5fea2a7263d122ecfb5a6ec1cd697b002f4653bc4fc8eb850fdbb3b414"
        },
        {
          "kind": "brand-profile",
          "ref": "examples/golden-business/brand-profile.json",
          "content_hash": "65de06ec581ebdf5a44f2bebb4dd7f0b1f4c896f0ccc1e8d28e1e88fe114366b"
        },
        {
          "kind": "site-config",
          "ref": "examples/golden-business/site-config.json",
          "content_hash": "033d138b425a5e2742581e87e51e039dcb1add211d1dabcecad50650519bd438"
        }
      ],
      "output": {
        "kind": "site-snapshot",
        "document": {
          "schema_version": "0.1.0",
          "snapshot_id": "snapshot-golden-001",
          "site_id": "site-golden-001",
          "business_id": "golden-business-synthetic-001",
          "site_config_hash": "033d138b425a5e2742581e87e51e039dcb1add211d1dabcecad50650519bd438",
          "truth_snapshot": {
            "business_truth_version": "0.1.0",
            "content_hash": "de59f2135a5fa19bcd08b136d23574bd46a8e056098891f3d0e7b09526227e87"
          },
          "brand_profile": {
            "brand_profile_id": "brand-golden-001",
            "content_hash": "65de06ec581ebdf5a44f2bebb4dd7f0b1f4c896f0ccc1e8d28e1e88fe114366b"
          },
          "recipe": {
            "recipe_id": "generic-information",
            "recipe_version": "0.1.0",
            "content_hash": "692aef5fea2a7263d122ecfb5a6ec1cd697b002f4653bc4fc8eb850fdbb3b414"
          },
          "mode": "demo",
          "indexing": "noindex",
          "build": {
            "build_id": "fixture-build-001",
            "engine_version": "static-fixture-0.1.0",
            "created_at": "2026-09-29T12:00:00Z"
          },
          "entrypoint": "index.html",
          "artifacts": [
            {
              "path": "index.html",
              "media_type": "text/html",
              "sha256": "cbdcbe35d82114e725ce66ff4b961ef0637197a62be8b7fadebd67f74458da9f",
              "bytes": 462
            }
          ],
          "qa": {
            "status": "not_run",
            "report_ref": null
          },
          "publication": {
            "status": "not_published",
            "url": null
          }
        }
      },
      "warnings": [
        "Fixture sintético. No se ejecutó un agente IA ni una auditoría de navegador."
      ],
      "error": null
    }
  }
}
